"Gemeinde_Nr","Gemeinde_color","Ja_Stimmen_In_Prozent","Nein_Stimmen_In_Prozent","Gemeinde_KT_d","Gemeinde_KT_f","Gemeinde_KT_i","Text_d","Text_f","Text_i"
3291,59.8,59.8,40.2,"Bad Ragaz SG","Bad Ragaz (SG)","Bad Ragaz SG","Ja zur elektronischen Identität in Bad Ragaz. Die Gemeinde hat das E-ID-Gesetz mit 59,8 Prozent der Stimmen angenommen.","Les électeurs de Bad Ragaz valident la loi sur les services d'identification électronique avec 59,8 pour cent de oui.","A Bad Ragaz i cittadini hanno accolto, con il 59,8 percento dei voti, la legge federale sui servizi d’identificazione elettronica."
3292,74.2,74.2,25.8,"Flums SG","Flums (SG)","Flums SG","Mit 74,2 Prozent Ja-Stimmen hat eine Mehrheit der Abstimmenden in Flums das E-ID-Gesetz angenommen.","Les habitants de Flums acceptent la loi sur les services d'identification électronique avec 74,2 pour cent de oui.","Nel comune di Flums la legge sull'identificazione elettronica è stata accetata con il 74,2 percento dei voti."
3293,70.2,70.2,29.8,"Mels SG","Mels (SG)","Mels SG","Das E-ID-Gesetz ist in Mels mit 70,2 Prozent der Stimmen angenommen worden.","A Mels, les habitants sont favorables à la loi sur les services d'identification électronique avec 70,2 pour cent de oui.","I cittadini di Mels si sono espressi a favore della legge sull'identificazione elettronica. Il testo è stato approvato con il 70,2 percento dei voti."
3294,71,71,29,"Pfäfers SG","Pfäfers (SG)","Pfäfers SG","Mit 71 Prozent Ja-Stimmen hat eine Mehrheit der Abstimmenden in Pfäfers das E-ID-Gesetz angenommen.","Les habitants de Pfäfers acceptent la loi sur les services d'identification électronique avec 71 pour cent de oui.","Nel comune di Pfäfers la legge sull'identificazione elettronica è stata accetata con il 71 percento dei voti."
3295,64.9,64.9,35.1,"Quarten SG","Quarten (SG)","Quarten SG","Mit 64,9 Prozent Ja-Stimmen hat eine Mehrheit der Abstimmenden in Quarten das E-ID-Gesetz angenommen.","Les habitants de Quarten acceptent la loi sur les services d'identification électronique avec 64,9 pour cent de oui.","Nel comune di Quarten la legge sull'identificazione elettronica è stata accetata con il 64,9 percento dei voti."
3296,58.4,58.4,41.6,"Sargans SG","Sargans (SG)","Sargans SG","Mit 58,4 Prozent Ja-Stimmen hat eine Mehrheit der Abstimmenden in Sargans das E-ID-Gesetz angenommen.","Les habitants de Sargans acceptent la loi sur les services d'identification électronique avec 58,4 pour cent de oui.","Nel comune di Sargans la legge sull'identificazione elettronica è stata accetata con il 58,4 percento dei voti."
3297,66,66,34,"Vilters-Wangs SG","Vilters-Wangs (SG)","Vilters-Wangs SG","Vilters-Wangs ist für die Einführung einer elektronischen Identität. Die Gemeinde hat das E-ID-Gesetz mit 1'535 Ja zu 791 Nein zugestimmt. Das entspricht einem Ja-Stimmen-Anteil von 66 Prozent.","La loi sur les services d'identification électronique passe la rampe à Vilters-Wangs avec 66 pour cent de oui.","Da Vilters-Wangs è arrivato un ""sì"" alle urne per la legge sull'identificazione elettronica. I cittadini hanno accolto il testo con il 66 percento dei voti."
3298,62.4,62.4,37.6,"Walenstadt SG","Walenstadt (SG)","Walenstadt SG","Ja zur elektronischen Identität in Walenstadt. Die Gemeinde hat das E-ID-Gesetz mit 62,4 Prozent der Stimmen angenommen.","Les électeurs de Walenstadt valident la loi sur les services d'identification électronique avec 62,4 pour cent de oui.","A Walenstadt i cittadini hanno accolto, con il 62,4 percento dei voti, la legge federale sui servizi d’identificazione elettronica."
