"Gemeinde_Nr","Gemeinde_color","Ja_Stimmen_In_Prozent","Nein_Stimmen_In_Prozent","Gemeinde_KT_d","Gemeinde_KT_f","Gemeinde_KT_i","Text_d","Text_f","Text_i"
3291,10.8,10.8,89.2,"Bad Ragaz SG","Bad Ragaz (SG)","Bad Ragaz SG","In Bad Ragaz das Freihandelsabkommen mit Indonesien keine Mehrheit gefunden: 89,2 Prozent haben es abgelehnt.","L'accord de libre-échange avec l'Indonésie échoue à Bad Ragaz avec 89,2 pour cent de non.","A Bad Ragaz i cittadini hanno bocciato, con il 89,2 percento dei voti, l'accordo di libero scambio con l'Indonesia."
3292,50,0,0,"Flums SG","Flums (SG)","Flums SG","Die Resultate von dieser Gemeinde sind noch nicht bekannt.","Les résultats ne sont pas encore connus dans cette commune.","I resultati di questa comune non sono ancora noti."
3293,50.6,50.6,49.4,"Mels SG","Mels (SG)","Mels SG","Das Freihandelsabkommen mit Indonesien ist in Mels mit 9'369 Ja zu 9'143 Nein angenommen worden. Das entspricht 50,6 Prozent der Stimmen.","A Mels, les habitants sont favorables à l'accord de libre-échange avec l'Indonésie avec 50,6 pour cent de oui.","I cittadini di Mels si sono espressi a favore dell'accordo di libero scambio con l'Indonesia. Il testo è stato approvato con il 50,6 percento dei voti."
3294,50,0,0,"Pfäfers SG","Pfäfers (SG)","Pfäfers SG","Die Resultate von dieser Gemeinde sind noch nicht bekannt.","Les résultats ne sont pas encore connus dans cette commune.","I resultati di questa comune non sono ancora noti."
3295,24,24,76,"Quarten SG","Quarten (SG)","Quarten SG","Die Gemeinde Quarten ist gegen das Freihandelsabkommen mit Indonesien: Sie hat den Bundesbeschluss mit 76 Prozent Nein verworfen.","Les habitants de Quarten rejettent l'accord de libre-échange avec l'Indonésie avec 76 pour cent de non.","Nel comune di Quarten l'accordo di libero scambio con l'Indonesia è stato bocciato con il 76 percento dei voti."
3296,50,0,0,"Sargans SG","Sargans (SG)","Sargans SG","Die Resultate von dieser Gemeinde sind noch nicht bekannt.","Les résultats ne sont pas encore connus dans cette commune.","I resultati di questa comune non sono ancora noti."
3297,28.4,28.4,71.6,"Vilters-Wangs SG","Vilters-Wangs (SG)","Vilters-Wangs SG","Nein zum Freihandelsabkommen mit Indonesien: Vilters-Wangs hat den Bundesbeschluss mit 71,6 Prozent Nein-Stimmen verworfen.","L'accord de libre-échange avec l'Indonésie ne passe pas la rampe à Vilters-Wangs avec 71,6 pour cent de non.","Da Vilters-Wangs è arrivato un ""no"" alle urne per il partenariato economico globale con l'Indonesia. I cittadini hanno respinto il testo con il 71,6 percento dei voti."
3298,50,0,0,"Walenstadt SG","Walenstadt (SG)","Walenstadt SG","Die Resultate von dieser Gemeinde sind noch nicht bekannt.","Les résultats ne sont pas encore connus dans cette commune.","I resultati di questa comune non sono ancora noti."
